{
  "$schema": "https://json-schema.org/draft/2020-12/schema",
  "$id": "https://pptx-creator.local/deck-plan.schema.json",
  "title": "Creative Deck Plan 0.1",
  "type": "object",
  "additionalProperties": false,
  "required": ["version", "title", "language", "designRead", "dials", "audience", "narrativeBeats", "slides"],
  "properties": {
    "version": { "const": "0.1.0" },
    "title": { "type": "string", "minLength": 1 },
    "language": { "type": "string", "minLength": 2 },
    "designRead": { "type": "string", "minLength": 1, "pattern": "^[^\\r\\n]+$" },
    "dials": {
      "type": "object", "additionalProperties": false,
      "required": ["compositionVariance", "visualDensity", "visualEnergy"],
      "properties": {
        "compositionVariance": { "type": "number", "minimum": 0, "maximum": 100 },
        "visualDensity": { "type": "number", "minimum": 0, "maximum": 100 },
        "visualEnergy": { "type": "number", "minimum": 0, "maximum": 100 }
      }
    },
    "audience": { "type": "string", "minLength": 1 },
    "narrativeBeats": { "type": "array", "minItems": 1, "items": { "type": "string", "minLength": 1 } },
    "intentOverride": { "type": "object" },
    "slides": {
      "type": "array", "minItems": 1,
      "items": {
        "type": "object", "additionalProperties": false,
        "required": ["id", "message", "layoutFamily", "contentReferences", "assetReferences", "content"],
        "properties": {
          "id": { "type": "string", "minLength": 1 }, "message": { "type": "string", "minLength": 1 },
          "layoutFamily": { "enum": ["cover", "architecture", "comparison", "process", "dashboard", "quote", "matrix", "closing"] },
          "contentReferences": { "type": "array", "items": { "type": "string" } },
          "assetReferences": { "type": "array", "items": { "type": "string" } },
          "content": { "type": "object" }
        }
      }
    }
  }
}
