{
  "version": "0.1.0",
  "title": "From Brief to Editable Deck",
  "language": "en-US",
  "designRead": "A confident editorial-technical story with deliberate asymmetry, restrained density, and one strong visual idea per slide.",
  "dials": {
    "compositionVariance": 72,
    "visualDensity": 54,
    "visualEnergy": 62
  },
  "audience": "Product and engineering leaders deciding how to operationalize presentation quality",
  "narrativeBeats": [
    "Frame the promise",
    "Explain the system",
    "Land the message"
  ],
  "slides": [
    {
      "id": "slide-cover",
      "message": "Editable decks can be both systematic and distinctive",
      "layoutFamily": "cover",
      "contentReferences": ["brief:promise"],
      "assetReferences": [],
      "content": {
        "headline": "From Brief to Editable Deck",
        "subtitle": "A quality system for faster, clearer presentation production"
      }
    }
  ]
}
